{
  "advisory": true,
  "cases": [
    {
      "id": "V001",
      "keys_wrong": [],
      "merge_allowed": true,
      "passed": true,
      "row": "11.7.9#1"
    },
    {
      "id": "V002",
      "keys_wrong": [],
      "merge_allowed": true,
      "passed": true,
      "row": "11.7.9#1"
    },
    {
      "id": "V003",
      "keys_wrong": [],
      "merge_allowed": true,
      "passed": true,
      "row": "11.7.9#1"
    },
    {
      "id": "V004",
      "keys_wrong": [],
      "merge_allowed": true,
      "passed": true,
      "row": "11.7.9#1"
    },
    {
      "id": "V005",
      "keys_wrong": [],
      "merge_allowed": true,
      "passed": true,
      "row": "11.7.9#1"
    },
    {
      "id": "V006",
      "keys_wrong": [],
      "merge_allowed": true,
      "passed": true,
      "row": "11.7.9#1"
    },
    {
      "id": "V007",
      "keys_wrong": [],
      "merge_allowed": false,
      "passed": true,
      "row": "11.7.9#1"
    },
    {
      "id": "V008",
      "keys_wrong": [],
      "merge_allowed": false,
      "passed": true,
      "row": "11.7.9#1"
    },
    {
      "id": "V009",
      "keys_wrong": [],
      "merge_allowed": false,
      "passed": true,
      "row": "11.7.9#1"
    },
    {
      "id": "V010",
      "keys_wrong": [],
      "merge_allowed": false,
      "passed": true,
      "row": "11.7.9#1"
    },
    {
      "id": "V011",
      "keys_wrong": [],
      "merge_allowed": true,
      "passed": true,
      "row": "11.7.9#1"
    },
    {
      "id": "V012",
      "keys_wrong": [],
      "merge_allowed": true,
      "passed": true,
      "row": "11.7.9#1"
    },
    {
      "id": "V013",
      "keys_wrong": [],
      "merge_allowed": false,
      "passed": true,
      "row": "11.7.9#1"
    },
    {
      "id": "V014",
      "keys_wrong": [],
      "merge_allowed": true,
      "passed": true,
      "row": "11.7.9#1"
    },
    {
      "id": "V015",
      "keys_wrong": [],
      "merge_allowed": true,
      "passed": true,
      "row": "11.7.9#1"
    },
    {
      "id": "V016",
      "keys_wrong": [],
      "merge_allowed": false,
      "passed": true,
      "row": "11.7.9#1"
    },
    {
      "id": "V017",
      "keys_wrong": [],
      "merge_allowed": true,
      "passed": true,
      "row": "11.7.9#2"
    },
    {
      "id": "V018",
      "keys_wrong": [],
      "merge_allowed": true,
      "passed": true,
      "row": "11.7.9#2"
    },
    {
      "id": "V019",
      "keys_wrong": [],
      "merge_allowed": true,
      "passed": true,
      "row": "11.7.9#2"
    },
    {
      "id": "V020",
      "keys_wrong": [],
      "merge_allowed": true,
      "passed": true,
      "row": "11.7.9#2"
    },
    {
      "id": "V021",
      "keys_wrong": [],
      "merge_allowed": false,
      "passed": true,
      "row": "11.7.9#2"
    },
    {
      "id": "V022",
      "keys_wrong": [],
      "merge_allowed": false,
      "passed": true,
      "row": "11.7.9#2"
    },
    {
      "id": "V023",
      "keys_wrong": [],
      "merge_allowed": false,
      "passed": true,
      "row": "11.7.9#2"
    },
    {
      "id": "V024",
      "keys_wrong": [],
      "merge_allowed": false,
      "passed": true,
      "row": "11.7.9#2"
    },
    {
      "id": "V025",
      "keys_wrong": [],
      "merge_allowed": false,
      "passed": true,
      "row": "11.7.9#3"
    },
    {
      "id": "V026",
      "keys_wrong": [],
      "merge_allowed": false,
      "passed": true,
      "row": "11.7.9#3"
    },
    {
      "id": "V027",
      "keys_wrong": [],
      "merge_allowed": false,
      "passed": true,
      "row": "11.7.9#3"
    },
    {
      "id": "V028",
      "keys_wrong": [],
      "merge_allowed": false,
      "passed": true,
      "row": "11.7.9#3"
    },
    {
      "id": "V029",
      "keys_wrong": [],
      "merge_allowed": false,
      "passed": true,
      "row": "11.7.9#3"
    },
    {
      "id": "V030",
      "keys_wrong": [],
      "merge_allowed": false,
      "passed": true,
      "row": "11.7.9#3"
    },
    {
      "id": "V031",
      "keys_wrong": [],
      "merge_allowed": false,
      "passed": true,
      "row": "11.7.9#3"
    },
    {
      "id": "V032",
      "keys_wrong": [],
      "merge_allowed": false,
      "passed": true,
      "row": "11.7.9#3"
    },
    {
      "id": "V033",
      "keys_wrong": [],
      "merge_allowed": false,
      "passed": true,
      "row": "11.7.9#3"
    },
    {
      "id": "V034",
      "keys_wrong": [],
      "merge_allowed": false,
      "passed": true,
      "row": "11.7.9#3"
    },
    {
      "id": "V035",
      "keys_wrong": [],
      "merge_allowed": false,
      "passed": true,
      "row": "11.7.9#3"
    },
    {
      "id": "V036",
      "keys_wrong": [],
      "merge_allowed": false,
      "passed": true,
      "row": "11.7.9#3"
    },
    {
      "id": "V037",
      "keys_wrong": [],
      "merge_allowed": false,
      "passed": true,
      "row": "11.7.9#3"
    },
    {
      "id": "V038",
      "keys_wrong": [],
      "merge_allowed": false,
      "passed": true,
      "row": "11.7.9#3"
    },
    {
      "id": "V039",
      "keys_wrong": [],
      "merge_allowed": false,
      "passed": true,
      "row": "11.7.9#3"
    },
    {
      "id": "V040",
      "keys_wrong": [],
      "merge_allowed": false,
      "passed": true,
      "row": "11.7.9#3"
    },
    {
      "id": "V041",
      "keys_wrong": [],
      "merge_allowed": false,
      "passed": true,
      "row": "11.7.9#3"
    },
    {
      "id": "V042",
      "keys_wrong": [],
      "merge_allowed": false,
      "passed": true,
      "row": "11.7.9#3"
    },
    {
      "id": "V043",
      "keys_wrong": [],
      "merge_allowed": false,
      "passed": true,
      "row": "11.7.9#3"
    },
    {
      "id": "V044",
      "keys_wrong": [],
      "merge_allowed": false,
      "passed": true,
      "row": "11.7.9#3"
    },
    {
      "id": "V045",
      "keys_wrong": [],
      "merge_allowed": false,
      "passed": true,
      "row": "11.7.9#4"
    },
    {
      "id": "V046",
      "keys_wrong": [],
      "merge_allowed": false,
      "passed": true,
      "row": "11.7.9#4"
    },
    {
      "id": "V047",
      "keys_wrong": [],
      "merge_allowed": false,
      "passed": true,
      "row": "11.7.9#4"
    },
    {
      "id": "V048",
      "keys_wrong": [],
      "merge_allowed": false,
      "passed": true,
      "row": "11.7.9#4"
    },
    {
      "id": "V049",
      "keys_wrong": [],
      "merge_allowed": false,
      "passed": true,
      "row": "11.7.9#4"
    },
    {
      "id": "V050",
      "keys_wrong": [],
      "merge_allowed": false,
      "passed": true,
      "row": "11.7.9#4"
    },
    {
      "id": "V051",
      "keys_wrong": [],
      "merge_allowed": false,
      "passed": true,
      "row": "11.7.9#4"
    },
    {
      "id": "V052",
      "keys_wrong": [],
      "merge_allowed": false,
      "passed": true,
      "row": "11.7.9#4"
    },
    {
      "id": "V053",
      "keys_wrong": [],
      "merge_allowed": false,
      "passed": true,
      "row": "11.7.9#4"
    },
    {
      "id": "V054",
      "keys_wrong": [],
      "merge_allowed": false,
      "passed": true,
      "row": "11.7.9#4"
    },
    {
      "id": "V055",
      "keys_wrong": [],
      "merge_allowed": false,
      "passed": true,
      "row": "11.7.9#4"
    },
    {
      "id": "V056",
      "keys_wrong": [],
      "merge_allowed": false,
      "passed": true,
      "row": "11.7.9#4"
    },
    {
      "id": "V057",
      "keys_wrong": [],
      "merge_allowed": false,
      "passed": true,
      "row": "11.7.9#6"
    },
    {
      "id": "V058",
      "keys_wrong": [],
      "merge_allowed": false,
      "passed": true,
      "row": "11.7.9#6"
    },
    {
      "id": "V059",
      "keys_wrong": [],
      "merge_allowed": false,
      "passed": true,
      "row": "11.7.9#6"
    },
    {
      "id": "V060",
      "keys_wrong": [],
      "merge_allowed": false,
      "passed": true,
      "row": "11.7.9#6"
    },
    {
      "id": "V061",
      "keys_wrong": [],
      "merge_allowed": false,
      "passed": true,
      "row": "11.7.9#6"
    },
    {
      "id": "V062",
      "keys_wrong": [],
      "merge_allowed": true,
      "passed": true,
      "row": "11.7.9#6"
    },
    {
      "id": "V063",
      "keys_wrong": [],
      "merge_allowed": true,
      "passed": true,
      "row": "11.7.9#6"
    },
    {
      "id": "V064",
      "keys_wrong": [],
      "merge_allowed": false,
      "passed": true,
      "row": "11.7.9#6"
    },
    {
      "id": "V065",
      "keys_wrong": [],
      "merge_allowed": false,
      "passed": true,
      "row": "11.7.9#7"
    },
    {
      "id": "V066",
      "keys_wrong": [],
      "merge_allowed": false,
      "passed": true,
      "row": "11.7.9#7"
    },
    {
      "id": "V067",
      "keys_wrong": [],
      "merge_allowed": false,
      "passed": true,
      "row": "11.7.9#7"
    },
    {
      "id": "V068",
      "keys_wrong": [],
      "merge_allowed": true,
      "passed": true,
      "row": "11.7.9#7"
    },
    {
      "id": "V069",
      "keys_wrong": [],
      "merge_allowed": true,
      "passed": true,
      "row": "11.7.9#7"
    },
    {
      "id": "V070",
      "keys_wrong": [],
      "merge_allowed": false,
      "passed": true,
      "row": "11.7.9#7"
    },
    {
      "id": "V071",
      "keys_wrong": [],
      "merge_allowed": false,
      "passed": true,
      "row": "11.7.9#7"
    },
    {
      "id": "V072",
      "keys_wrong": [],
      "merge_allowed": false,
      "passed": true,
      "row": "11.7.9#7"
    },
    {
      "id": "V073",
      "keys_wrong": [],
      "merge_allowed": false,
      "passed": true,
      "row": "11.7.9#7"
    },
    {
      "id": "V074",
      "keys_wrong": [],
      "merge_allowed": false,
      "passed": true,
      "row": "11.7.9#7"
    },
    {
      "id": "V075",
      "keys_wrong": [],
      "merge_allowed": true,
      "passed": true,
      "row": "11.7.9#7"
    },
    {